Project Name,Mentor Name,Mentor Email,Mentee Name,Mentee Email,Project Details,Project Status
"AI-Powered Learning Management System","Dr. Sarah Johnson","sarah.johnson@git-india.edu.in","Alice Smith","alice.smith@git-india.edu.in","Develop an intelligent LMS with machine learning capabilities for personalized learning paths","active"
"Blockchain-Based Certificate Verification","Dr. Michael Chen","michael.chen@git-india.edu.in","Bob Wilson","bob.wilson@git-india.edu.in","Create a decentralized system for verifying academic certificates using blockchain technology","pending"
"Mobile Health Monitoring App","Dr. Emily Davis","emily.davis@git-india.edu.in","Carol Brown","carol.brown@git-india.edu.in","Build a mobile application for real-time health monitoring and data analysis","active"
"Smart Campus IoT Network","Dr. Robert Taylor","robert.taylor@git-india.edu.in","David Lee","david.lee@git-india.edu.in","Implement an IoT network for smart campus management and monitoring","pending"
"E-Commerce Platform with AR","Dr. Lisa Anderson","lisa.anderson@git-india.edu.in","Eva Martinez","eva.martinez@git-india.edu.in","Develop an e-commerce platform with augmented reality product visualization","active"
